{
  "policyVersion": "1.0",
  "policyId": "execution-binding-policy-v1",
  "gitCommandTimeoutMs": 15000,
  "maxGitOutputBytes": 1048576,
  "maxAuditedPaths": 256,
  "maxAuditedPathBytes": 1024,
  "maxTotalAuditedPathBytes": 65536,
  "maxHostEvidenceInputBytes": 1048576,
  "maxReadinessInputBytes": 1048576,
  "requiredHostCapabilities": [
    "BIND_WORKSPACE",
    "INTERRUPT_AGENT",
    "OBSERVE_AGENT_IDENTITY",
    "SPAWN_AGENT",
    "WAIT_AGENT"
  ],
  "admittedHostProfiles": [
    "CODEX_APP_NATIVE_V1"
  ]
}
